{
  "$schema": "https://json-schema.org/draft/2020-12/schema",
  "$id": "https://xianxia-engine.com/schemas/formula_library.json",
  "title": "Formula Library Schema",
  "description": "Schema for formula library definitions",
  "type": "object",
  "required": ["meta", "formula_categories", "formulas", "operators", "constants"],
  "properties": {
    "meta": {"$ref": "#/$defs/metaInfo"},
    "formula_categories": {
      "type": "object",
      "additionalProperties": {"type": "string"}
    },
    "formulas": {
      "type": "object",
      "additionalProperties": {
        "type": "object",
        "required": ["id", "category", "description", "input_vars", "expression", "output_type", "used_in"],
        "properties": {
          "id": {"type": "string"},
          "category": {"type": "string"},
          "description": {"type": "string"},
          "input_vars": {
            "type": "array",
            "items": {"type": "string"}
          },
          "expression": {"type": "string"},
          "output_type": {"type": "string"},
          "used_in": {
            "type": "array",
            "items": {"type": "string"}
          },
          "variance": {"type": "number"},
          "cap": {"type": "number"},
          "minimum": {"type": "string"},
          "range": {
            "type": "array",
            "items": {"type": "integer"},
            "minItems": 2,
            "maxItems": 2
          }
        }
      }
    },
    "operators": {
      "type": "object",
      "properties": {
        "arithmetic": {"type": "array", "items": {"type": "string"}},
        "comparison": {"type": "array", "items": {"type": "string"}},
        "logical": {"type": "array", "items": {"type": "string"}},
        "conditional": {"type": "array", "items": {"type": "string"}},
        "special": {"type": "array", "items": {"type": "string"}}
      }
    },
    "constants": {
      "type": "object",
      "additionalProperties": {"type": "number"}
    },
    "validation_rules": {"type": "object"},
    "_custom_tags": {"$ref": "#/$defs/customTags"}
  },
  "$defs": {
    "metaInfo": {
      "type": "object",
      "required": ["version", "description", "schema_version"],
      "properties": {
        "version": {"type": "string", "pattern": "^\\d+\\.\\d+\\.\\d+$"},
        "description": {"type": "string"},
        "schema_version": {"type": "string"},
        "last_modified": {"type": "string", "format": "date"}
      }
    },
    "customTags": {
      "type": "array",
      "items": {"type": "string"}
    }
  }
}