{
  "meta": {
    "version": "3.0.0",
    "description": "修仙世界引擎公式库定义",
    "schema_version": "2020-12",
    "last_modified": "2025-06-07"
  },
  "formula_categories": {
    "attribute": "属性计算相关公式",
    "combat": "战斗计算相关公式",
    "cultivation": "修炼计算相关公式",
    "economic": "经济系统相关公式",
    "probability": "概率计算相关公式",
    "progression": "成长进度相关公式"
  },
  "formulas": {
    "health_calculation": {
      "id": "health_calculation",
      "category": "attribute",
      "description": "计算最大生命值",
      "input_vars": ["constitution", "realm_level", "body_cultivation_bonus"],
      "expression": "constitution * 15 + realm_level * 100 + body_cultivation_bonus",
      "output_type": "integer",
      "used_in": ["character_stats", "combat_system"]
    },
    "mana_calculation": {
      "id": "mana_calculation",
      "category": "attribute",
      "description": "计算最大法力值",
      "input_vars": ["spiritual_power", "intelligence", "spiritual_root_bonus"],
      "expression": "spiritual_power * 3 + intelligence * 10 + spiritual_root_bonus",
      "output_type": "integer",
      "used_in": ["character_stats", "skill_system"]
    },
    "physical_damage": {
      "id": "physical_damage",
      "category": "combat",
      "description": "物理伤害计算",
      "input_vars": ["attack_power", "weapon_damage", "skill_multiplier", "defense", "armor"],
      "expression": "max(1, (attack_power + weapon_damage) * skill_multiplier - (defense + armor))",
      "output_type": "integer",
      "variance": 0.1,
      "used_in": ["combat_system"]
    },
    "magical_damage": {
      "id": "magical_damage",
      "category": "combat",
      "description": "法术伤害计算",
      "input_vars": ["spell_power", "element_multiplier", "magic_resistance"],
      "expression": "spell_power * element_multiplier * (1 - min(0.9, magic_resistance))",
      "output_type": "float",
      "used_in": ["combat_system", "skill_system"]
    },
    "hit_chance": {
      "id": "hit_chance",
      "category": "combat",
      "description": "命中率计算",
      "input_vars": ["accuracy", "evasion", "level_difference"],
      "expression": "min(0.95, max(0.05, (accuracy - evasion + level_difference * 5) / 100))",
      "output_type": "percentage",
      "used_in": ["combat_system"]
    },
    "critical_chance": {
      "id": "critical_chance",
      "category": "combat",
      "description": "暴击率计算",
      "input_vars": ["base_critical", "weapon_critical", "skill_critical", "luck"],
      "expression": "min(0.75, (base_critical + weapon_critical + skill_critical + luck * 0.001))",
      "output_type": "percentage",
      "used_in": ["combat_system"]
    },
    "cultivation_speed": {
      "id": "cultivation_speed",
      "category": "cultivation",
      "description": "修炼速度计算",
      "input_vars": ["base_speed", "spiritual_root_quality", "comprehension", "environment_bonus", "technique_efficiency"],
      "expression": "base_speed * spiritual_root_quality * comprehension * (1 + environment_bonus) * technique_efficiency",
      "output_type": "float",
      "used_in": ["cultivation_system"]
    },
    "breakthrough_chance": {
      "id": "breakthrough_chance",
      "category": "cultivation",
      "description": "突破成功率计算",
      "input_vars": ["base_rate", "comprehension", "willpower", "spiritual_root_quality", "failure_count", "special_items"],
      "expression": "base_rate * comprehension * (willpower / 100) * (1 + spiritual_root_quality * 0.2) * (1 - failure_count * 0.1) * (1 + special_items * 0.3)",
      "output_type": "percentage",
      "cap": 0.95,
      "used_in": ["cultivation_system", "breakthrough_events"]
    },
    "experience_gain": {
      "id": "experience_gain",
      "category": "progression",
      "description": "经验获取计算",
      "input_vars": ["base_exp", "level_difference", "difficulty_multiplier", "combo_bonus", "team_bonus"],
      "expression": "base_exp * (1 + level_difference * 0.1) * difficulty_multiplier * (1 + combo_bonus) * (1 + team_bonus)",
      "output_type": "integer",
      "used_in": ["combat_rewards", "quest_rewards"]
    },
    "skill_damage": {
      "id": "skill_damage",
      "category": "combat",
      "description": "技能伤害计算",
      "input_vars": ["skill_base_damage", "skill_level", "attribute_scaling", "mastery_bonus"],
      "expression": "skill_base_damage * (1 + skill_level * 0.1) * attribute_scaling * (1 + mastery_bonus)",
      "output_type": "float",
      "used_in": ["skill_system"]
    },
    "regeneration_rate": {
      "id": "regeneration_rate",
      "category": "attribute",
      "description": "生命/法力恢复速度",
      "input_vars": ["max_value", "constitution_or_meditation", "recovery_bonus", "status_effects"],
      "expression": "max_value * 0.01 * (1 + constitution_or_meditation / 100) * (1 + recovery_bonus) * status_effects",
      "output_type": "float",
      "used_in": ["combat_system", "rest_system"]
    },
    "item_drop_chance": {
      "id": "item_drop_chance",
      "category": "probability",
      "description": "物品掉落概率",
      "input_vars": ["base_drop_rate", "luck", "treasure_find", "enemy_level", "first_kill"],
      "expression": "base_drop_rate * (1 + luck / 100) * (1 + treasure_find) * (1 + enemy_level * 0.01) * (first_kill ? 2 : 1)",
      "output_type": "percentage",
      "used_in": ["loot_system"]
    },
    "shop_price": {
      "id": "shop_price",
      "category": "economic",
      "description": "商店价格计算",
      "input_vars": ["base_price", "reputation_discount", "charisma_bonus", "faction_standing", "merchant_mood"],
      "expression": "base_price * (1 - reputation_discount) * (1 - charisma_bonus * 0.01) * faction_standing * merchant_mood",
      "output_type": "integer",
      "minimum": "base_price * 0.5",
      "used_in": ["trading_system"]
    },
    "karma_update": {
      "id": "karma_update",
      "category": "attribute",
      "description": "业力值更新计算",
      "input_vars": ["current_karma", "action_moral_weight", "luck", "witness_multiplier"],
      "expression": "current_karma + action_moral_weight * (1 + luck / 100) * witness_multiplier",
      "output_type": "integer",
      "range": [-100, 100],
      "used_in": ["event_engine", "npc_reputation"]
    },
    "formation_power": {
      "id": "formation_power",
      "category": "combat",
      "description": "阵法威力计算",
      "input_vars": ["base_power", "participants", "formation_level", "synchronization", "location_bonus"],
      "expression": "base_power * sqrt(participants) * formation_level * synchronization * (1 + location_bonus)",
      "output_type": "float",
      "used_in": ["formation_system"]
    },
    "alchemy_success": {
      "id": "alchemy_success",
      "category": "probability",
      "description": "炼丹成功率",
      "input_vars": ["base_rate", "alchemy_skill", "recipe_difficulty", "cauldron_quality", "material_quality"],
      "expression": "min(0.95, base_rate * (alchemy_skill / recipe_difficulty) * cauldron_quality * material_quality)",
      "output_type": "percentage",
      "used_in": ["crafting_system"]
    },
    "spirit_beast_loyalty": {
      "id": "spirit_beast_loyalty",
      "category": "attribute",
      "description": "灵兽忠诚度计算",
      "input_vars": ["base_loyalty", "affection", "time_together", "feeding_quality", "battle_synergy"],
      "expression": "min(100, base_loyalty + affection * 0.5 + log(time_together + 1) * 10 + feeding_quality * 0.2 + battle_synergy * 0.3)",
      "output_type": "integer",
      "used_in": ["pet_system"]
    },
    "realm_suppression": {
      "id": "realm_suppression",
      "category": "combat",
      "description": "境界压制效果",
      "input_vars": ["tier_difference", "suppressor_realm", "target_willpower"],
      "expression": "tier_difference * tier_difference * 0.1 * (1 + suppressor_realm * 0.05) * (1 - target_willpower / 200)",
      "output_type": "percentage",
      "cap": 0.9,
      "used_in": ["combat_system", "social_system"]
    },
    "sect_contribution": {
      "id": "sect_contribution",
      "category": "progression",
      "description": "宗门贡献度计算",
      "input_vars": ["action_value", "member_rank", "faction_need", "completion_quality"],
      "expression": "action_value * (1 + member_rank * 0.1) * faction_need * completion_quality",
      "output_type": "integer",
      "used_in": ["faction_system"]
    },
    "enlightenment_chance": {
      "id": "enlightenment_chance",
      "category": "cultivation",
      "description": "顿悟机率计算",
      "input_vars": ["comprehension", "meditation_level", "environment_spiritual_density", "mental_state", "random_factor"],
      "expression": "(comprehension * 0.05 + meditation_level * 0.01) * environment_spiritual_density * mental_state * random_factor",
      "output_type": "percentage",
      "cap": 0.1,
      "used_in": ["cultivation_events"]
    },
    "auction_bid_limit": {
      "id": "auction_bid_limit",
      "category": "economic",
      "description": "拍卖出价上限",
      "input_vars": ["item_perceived_value", "current_wealth", "item_need", "competitor_count", "auction_heat"],
      "expression": "min(current_wealth * 0.8, item_perceived_value * (1 + item_need) * (1 + log(competitor_count + 1) * 0.1) * auction_heat)",
      "output_type": "integer",
      "used_in": ["auction_system"]
    },
    "territory_income": {
      "id": "territory_income",
      "category": "economic",
      "description": "领地收入计算",
      "input_vars": ["base_income", "development_level", "population", "trade_routes", "stability"],
      "expression": "base_income * development_level * log(population + 1) * (1 + trade_routes * 0.2) * stability",
      "output_type": "integer",
      "used_in": ["territory_management"]
    },
    "skill_mastery_progress": {
      "id": "skill_mastery_progress",
      "category": "progression",
      "description": "技能熟练度进度",
      "input_vars": ["usage_count", "skill_difficulty", "intelligence", "teacher_bonus", "perfect_execution"],